{
  "protocol_version": "2.0",
  "request_id": "web-call-assistant-system-design-2026-07-14-v1",
  "created_at": "2026-07-14T13:15:15-04:00",
  "reasoning_heavy_assessment": {
    "is_reasoning_heavy": true,
    "triggers": [
      "Planning and architecture",
      "Investigation of an existing workflow and competing implementation approaches",
      "Consequential technical and security trade-offs",
      "Synthesis across a substantial product brief, protocol, schemas, and operational examples",
      "Creation of substantial design and implementation-planning artifacts"
    ],
    "justification": "The task is to convert a product vision and an existing manual protocol into a reliable human-in-the-loop system design, requiring independent architectural judgment, web research, risk analysis, migration planning, and test design."
  },
  "task_type": "architecture_review_and_implementation_planning",
  "title": "Design the upgraded ChatGPT Web Call Assistant from the existing protocol",
  "objective": "Independently analyze the supplied product brief and the current working ChatGPT Web-call protocol, then produce a concrete, implementation-ready design for a user-controlled system that preserves the existing exchange history and reliability principles while adding the proposed Chrome-extension-assisted Go/Done workflow, durable state tracking, validation, recovery, and whole-project completion management.",
  "scope": {
    "in_scope": [
      "Read every uploaded file completely and reconstruct how the current manual system works end to end.",
      "Distinguish explicit product requirements, current authoritative behavior, examples, assumptions, recommendations, and unresolved choices.",
      "Evaluate at least three feasible implementation architectures and recommend one using an explicit decision matrix.",
      "Design responsibilities and boundaries for Codex, the local orchestration layer, the Chrome extension, ChatGPT Web, the filesystem exchange folders, and the user.",
      "Design the complete Go-to-Done workflow, including preparation, user confirmation, submission, response readiness, collection, validation, revision, acceptance, integration, pause, retry, and failure recovery.",
      "Design a durable state machine and machine-readable data contracts that remain compatible with or deliberately migrate the existing timestamped request/response exchange layout.",
      "Address safe request packaging, exact file disclosure, response-to-call association, download handling, browser/session uncertainty, idempotency, resumability, traceability, logging, privacy, least privilege, and protection against collecting unrelated page content.",
      "Define what can and cannot be reliably automated in a changing ChatGPT Web UI while preserving a clear user-authorized action boundary.",
      "Provide a phased implementation roadmap with verification gates and a comprehensive test strategy, including mocked tests, browser integration tests, failure injection, manual user-acceptance tests, and rollback criteria.",
      "Identify the smallest coherent first implementation slice that proves the architecture without pretending the entire product is complete.",
      "Use current web research where necessary to verify browser-extension platform constraints and relevant ChatGPT/OpenAI product constraints."
    ],
    "out_of_scope": [
      "Writing or modifying repository code in this call",
      "Returning a finished Chrome extension or executable implementation",
      "Changing the supplied product requirements, protocol files, schemas, examples, or repository instructions",
      "Using or requesting secrets, credentials, API keys, browser cookies, or authentication exports",
      "Analyzing the thesis or defense content contained incidentally in the operational example beyond understanding the call mechanics",
      "Claiming literal 100 percent reliability in conditions outside the system's control",
      "Designing hidden, unattended, or user-bypassing automation"
    ]
  },
  "source_authority": [
    {
      "rank": 1,
      "source": "chatgpt_web_call_assistant_brief.txt",
      "role": "Primary product intent and user-experience requirements",
      "allowed_uses": [
        "Determine the target product behavior, role boundaries, human-control requirements, reliability ambition, and completion model",
        "Identify requirements that the proposed design must satisfy"
      ],
      "prohibited_uses": [
        "Treating deliberately unspecified technical choices as already decided",
        "Weakening the explicit user-control and no-hidden-automation requirements"
      ]
    },
    {
      "rank": 2,
      "source": "F1D_AGENTS.md and CHATGPT_WEB_PROTOCOL.json",
      "role": "Authoritative current repository gate and manual Web-call protocol",
      "allowed_uses": [
        "Reconstruct current triage, exchange-folder, transport, output, authority, and validation rules",
        "Define backward-compatibility and migration requirements"
      ],
      "prohibited_uses": [
        "Assuming the current manual transport is the required final architecture",
        "Overriding the product brief where the brief explicitly upgrades the system"
      ]
    },
    {
      "rank": 3,
      "source": "WEB_REQUEST_SCHEMA.json, WEB_RESPONSE_SCHEMA.json, EXAMPLE_EXCHANGE_MANIFEST.json, EXAMPLE_WEB_REVIEW_REQUEST.json, and EXAMPLE_WEB_RESPONSE.json",
      "role": "Current data-contract definitions and evidence of one completed operational exchange",
      "allowed_uses": [
        "Assess strengths, omissions, compatibility constraints, status semantics, and validation behavior",
        "Use the examples to distinguish written protocol from demonstrated practice"
      ],
      "prohibited_uses": [
        "Treating thesis-specific content in the example as relevant product requirements",
        "Assuming an example field is universally correct merely because it appears once"
      ]
    },
    {
      "rank": 4,
      "source": "Current official web documentation and, when necessary, mature primary open-source project documentation",
      "role": "Evidence for browser-extension, download, storage, messaging, automation, security, and ChatGPT product constraints",
      "allowed_uses": [
        "Verify time-sensitive technical constraints and support architecture decisions",
        "Identify what is robust, brittle, prohibited, or user-mediated in current platforms"
      ],
      "prohibited_uses": [
        "Inventing undocumented ChatGPT APIs or capabilities",
        "Using marketing claims as proof of reliability",
        "Allowing external sources to override explicit user requirements"
      ]
    }
  ],
  "web_research": {
    "enabled": true,
    "objectives": [
      "Verify current Chrome Manifest V3 capabilities and restrictions relevant to user gestures, tabs, downloads, content scripts, storage, native messaging, and local communication",
      "Verify current official OpenAI or ChatGPT constraints relevant to browser interaction, file upload/download, authentication, automation, and acceptable use",
      "Identify mature primary-source patterns for resumable, idempotent, human-in-the-loop browser workflows and robust local orchestration"
    ],
    "source_requirements": [
      "Prefer official Chrome/Chromium, MDN, W3C, and OpenAI documentation for platform claims",
      "Use mature open-source project documentation or repositories only as corroborative implementation evidence",
      "Record the direct URL, page title, access date, and the exact design claim each source supports",
      "Separate documented facts from architectural inference",
      "Do not cite search-result snippets or unverified summaries"
    ],
    "citation_required": true
  },
  "context": {
    "current_state": "A functioning manual protocol already exists. Codex creates one timestamped exchange with request and response folders plus a manifest; Sina manually uploads request files and returns downloaded outputs; Web returns only a schema-valid JSON attachment and declared artifacts; Codex validates and integrates. No implemented extension or orchestration service is supplied in this package. The active_request object in CHATGPT_WEB_PROTOCOL.json identifies this system-design exchange; the EXAMPLE_* files document the prior completed exchange.",
    "desired_state": "A productized, human-authorized orchestration system in which Codex remains the durable project manager, ChatGPT Web performs bounded intellectual work, a Chrome extension reduces manual transfer through explicit Go and Done actions, and every call remains traceable, recoverable, validated, and linked to project completion.",
    "decision_posture": "Recommend a design, but explicitly expose trade-offs, confidence, dependencies, assumptions, and decisions that require Sina's approval. Preserve useful parts of the existing system unless a justified migration is safer.",
    "implementation_owner": "Codex will independently inspect the returned design, verify load-bearing claims, decide what to adopt, and perform later implementation and testing only after approval."
  },
  "inputs": [
    {
      "file": "chatgpt_web_call_assistant_brief.txt",
      "purpose": "Primary product brief for the upgraded system"
    },
    {
      "file": "F1D_AGENTS.md",
      "purpose": "Current repository-level universal reasoning gate and operational constraints"
    },
    {
      "file": "CHATGPT_WEB_PROTOCOL.json",
      "purpose": "Current authoritative manual Web-call protocol"
    },
    {
      "file": "WEB_REQUEST_SCHEMA.json",
      "purpose": "Current machine-readable work-request contract"
    },
    {
      "file": "WEB_RESPONSE_SCHEMA.json",
      "purpose": "Current machine-readable Web-response contract"
    },
    {
      "file": "EXAMPLE_EXCHANGE_MANIFEST.json",
      "purpose": "Operational example of a completed exchange manifest"